<?xml version="1.0" encoding="ISO-8859-1"?>
<channel version="1.0" xmlns="http://pear.php.net/channel-1.0" xmlns:xsi="http://www.w3.org/2001/XMLSchema-instance" xsi:schemaLocation="http://pear.php.net/channel-1.0
http://pear.php.net/dtd/channel-1.0.xsd">
 <name>pear.php.net</name>
 <suggestedalias>pear</suggestedalias>
 <summary>PHP Extension and Application Repository</summary>
 <servers>
  <primary>
   <xmlrpc>
    <function version="1.0">logintest</function>
    <function version="1.0">package.listLatestReleases</function>
    <function version="1.0">package.listAll</function>
    <function version="1.0">package.info</function>
    <function version="1.0">package.getDownloadURL</function>
    <function version="1.0">package.getDepDownloadURL</function>
    <function version="1.0">package.search</function>
    <function version="1.0">channel.listAll</function>
   </xmlrpc>
<!--   <rest>
    <baseurl type="package">http://pear.php.net/rest/1.0/package</baseurl>
    <baseurl type="category">http://pear.php.net/rest/1.0/category</baseurl>
   </rest> -->
  </primary>
 </servers>
</channel>
